{
  "schema": "exo.market.assurance.interface.v1",
  "coverage_claim": "none",
  "exochain_is_obligor": false,
  "instrument_family": "unspecified",
  "issuer_did": "",
  "subject_bundle_hash": "6666666666666666666666666666666666666666666666666666666666666666",
  "limit_minor": 0,
  "currency": "USD",
  "terms_hash": "5555555555555555555555555555555555555555555555555555555555555555",
  "statement": "Interface only. EXOCHAIN does not provide insurance, surety, or bonding. No coverage is in force."
}
